{
  "contract": "adapter",
  "projectName": "",
  "adapter": {
    "docs": "harness/README.md",
    "machineReadable": ".harness/config.json",
    "preflight": [],
    "stateSync": []
  },
  "paths": {
    "taskIndex": "harness/tasks.md",
    "ideaInbox": "harness/intake.md",
    "status": "harness/status.md",
    "specs": "harness/specs",
    "goals": "harness/goals",
    "milestones": "harness/milestones",
    "runs": ".harness/runs",
    "gateRecords": ".harness/runs",
    "deferredRegister": "harness/milestones",
    "mentalModels": "harness/mental-models",
    "mentalModelIndex": "harness/mental-models/README.md"
  },
  "language": {
    "default": "auto"
  },
  "artifactPolicy": {
    "runs": "tracked",
    "durableEvidence": ["harness/status.md", "harness/goals", "harness/milestones"],
    "retention": { "completedDays": 30, "blockedDays": 30, "keepLatest": 20 },
    "status": { "maxLines": 160 },
    "tasks": { "archive": "harness/tasks-archive.md", "keepDone": 10 }
  },
  "communication": {
    "commentary": "minimal"
  },
  "worktree": {
    "defaultPolicy": "ask"
  },
  "gates": {
    "requiredForCompletion": [
      "spec",
      "execution",
      "integration"
    ],
    "blocking": []
  }
}
