{
  "contract": "adapter",
  "projectName": "agent-harness",
  "adapter": {
    "docs": "harness/README.md",
    "machineReadable": ".harness/config.json",
    "preflight": [
      "Read AGENTS.md before editing repository files.",
      "Validate plugin changes with npm run validate:plugin."
    ],
    "stateSync": [
      "Update harness/tasks.md after meaningful task state changes.",
      "Update harness/status.md after execution or verification."
    ]
  },
  "paths": {
    "taskIndex": "harness/tasks.md",
    "status": "harness/status.md",
    "specs": "harness/specs",
    "goals": "harness/goals",
    "milestones": "harness/milestones",
    "runs": ".harness/runs",
    "gateRecords": ".harness/runs",
    "deferredRegister": "harness/milestones",
    "mentalModels": "harness/mental-models",
    "mentalModelIndex": "harness/mental-models/README.md"
  },
  "language": {
    "default": "zh-CN"
  },
  "communication": {
    "commentary": "minimal"
  },
  "artifactPolicy": {
    "runs": "local-only",
    "durableEvidence": [
      "harness/status.md",
      "harness/goals",
      "harness/milestones"
    ],
    "retention": {
      "completedDays": 30,
      "blockedDays": 30,
      "keepLatest": 20
    },
    "status": {
      "maxLines": 160
    },
    "tasks": {
      "archive": "harness/tasks-archive.md",
      "keepDone": 10
    }
  },
  "worktree": {
    "defaultPolicy": "ask"
  },
  "gates": {
    "requiredForCompletion": [
      "spec",
      "execution",
      "integration"
    ],
    "blocking": []
  }
}
